{
  "$schema": "https://json-schema.org/draft/2020-12/schema",
  "$id": "urn:resina:schema:toggle-part-paint-case:0.1.0",
  "title": "Resina Toggle Part Paint Case",
  "type": "object",
  "additionalProperties": false,
  "required": [
    "name",
    "requestChanges",
    "requestSchemaValid"
  ],
  "properties": {
    "name": {
      "type": "string",
      "minLength": 1
    },
    "requestChanges": {
      "$ref": "urn:resina:schema:surface-paint-case:0.1.0#/properties/requestChanges"
    },
    "requestSchemaValid": {
      "type": "boolean"
    },
    "expectedPhase": {
      "enum": [
        "rest",
        "hover",
        "pressed",
        "disabled"
      ]
    },
    "failure": {"const": true}
  },
  "oneOf": [
    {
      "required": [
        "expectedPhase"
      ],
      "not": {
        "required": [
          "failure"
        ]
      }
    },
    {
      "required": [
        "failure"
      ],
      "not": {
        "required": [
          "expectedPhase"
        ]
      }
    }
  ]
}
