[
  {
    "name": "track rest",
    "requestChanges": [
      {
        "path": "/part",
        "value": "track"
      },
      {
        "path": "/surface/states/states",
        "value": [
          "rest",
          "focused"
        ]
      }
    ],
    "requestSchemaValid": true,
    "expectedPhase": "rest"
  },
  {
    "name": "thumb rest",
    "requestChanges": [
      {
        "path": "/part",
        "value": "thumb"
      },
      {
        "path": "/surface/states/states",
        "value": [
          "rest",
          "focused"
        ]
      }
    ],
    "requestSchemaValid": true,
    "expectedPhase": "rest"
  },
  {
    "name": "track hover",
    "requestChanges": [
      {
        "path": "/part",
        "value": "track"
      },
      {
        "path": "/surface/states/states",
        "value": [
          "hover",
          "focused"
        ]
      }
    ],
    "requestSchemaValid": true,
    "expectedPhase": "hover"
  },
  {
    "name": "thumb hover",
    "requestChanges": [
      {
        "path": "/part",
        "value": "thumb"
      },
      {
        "path": "/surface/states/states",
        "value": [
          "hover",
          "focused"
        ]
      }
    ],
    "requestSchemaValid": true,
    "expectedPhase": "hover"
  },
  {
    "name": "track pressed",
    "requestChanges": [
      {
        "path": "/part",
        "value": "track"
      },
      {
        "path": "/surface/states/states",
        "value": [
          "pressed",
          "focused"
        ]
      }
    ],
    "requestSchemaValid": true,
    "expectedPhase": "pressed"
  },
  {
    "name": "thumb pressed",
    "requestChanges": [
      {
        "path": "/part",
        "value": "thumb"
      },
      {
        "path": "/surface/states/states",
        "value": [
          "pressed",
          "focused"
        ]
      }
    ],
    "requestSchemaValid": true,
    "expectedPhase": "pressed"
  },
  {
    "name": "track dragging",
    "requestChanges": [
      {
        "path": "/part",
        "value": "track"
      },
      {
        "path": "/surface/states/states",
        "value": [
          "pressed",
          "dragging",
          "focused"
        ]
      }
    ],
    "requestSchemaValid": true,
    "expectedPhase": "dragging"
  },
  {
    "name": "thumb dragging",
    "requestChanges": [
      {
        "path": "/part",
        "value": "thumb"
      },
      {
        "path": "/surface/states/states",
        "value": [
          "pressed",
          "dragging",
          "focused"
        ]
      }
    ],
    "requestSchemaValid": true,
    "expectedPhase": "dragging"
  },
  {
    "name": "track disabled",
    "requestChanges": [
      {
        "path": "/part",
        "value": "track"
      },
      {
        "path": "/surface/states/states",
        "value": [
          "disabled",
          "focused"
        ]
      }
    ],
    "requestSchemaValid": true,
    "expectedPhase": "disabled"
  },
  {
    "name": "thumb disabled",
    "requestChanges": [
      {
        "path": "/part",
        "value": "thumb"
      },
      {
        "path": "/surface/states/states",
        "value": [
          "disabled",
          "focused"
        ]
      }
    ],
    "requestSchemaValid": true,
    "expectedPhase": "disabled"
  },
  {
    "name": "readOnly",
    "requestChanges": [
      {
        "path": "/readOnly",
        "value": true
      },
      {
        "path": "/surface/states/states",
        "value": [
          "rest",
          "focused"
        ]
      },
      {
        "path": "/part",
        "value": "thumb"
      }
    ],
    "requestSchemaValid": true,
    "expectedPhase": "readOnly"
  },
  {
    "name": "readOnlyHover",
    "requestChanges": [
      {
        "path": "/readOnly",
        "value": true
      },
      {
        "path": "/surface/states/states",
        "value": [
          "hover",
          "focused"
        ]
      },
      {
        "path": "/part",
        "value": "thumb"
      }
    ],
    "requestSchemaValid": true,
    "expectedPhase": "readOnlyHover"
  },
  {
    "name": "disabled",
    "requestChanges": [
      {
        "path": "/readOnly",
        "value": true
      },
      {
        "path": "/surface/states/states",
        "value": [
          "disabled",
          "focused"
        ]
      },
      {
        "path": "/part",
        "value": "thumb"
      }
    ],
    "requestSchemaValid": true,
    "expectedPhase": "disabled"
  },
  {
    "name": "unsupported version",
    "requestChanges": [
      {
        "path": "/schemaVersion",
        "value": "9.9.9"
      }
    ],
    "requestSchemaValid": false,
    "failure": true
  },
  {
    "name": "unknown part",
    "requestChanges": [
      {
        "path": "/part",
        "value": "knob"
      }
    ],
    "requestSchemaValid": false,
    "failure": true
  },
  {
    "name": "object part",
    "requestChanges": [
      {
        "path": "/part",
        "value": {
          "track": null
        }
      }
    ],
    "requestSchemaValid": false,
    "failure": true
  },
  {
    "name": "object role",
    "requestChanges": [
      {
        "path": "/foregroundRole",
        "value": {
          "content.primary": null
        }
      }
    ],
    "requestSchemaValid": false,
    "failure": true
  },
  {
    "name": "empty adjacent",
    "requestChanges": [
      {
        "path": "/adjacentRanges",
        "value": []
      }
    ],
    "requestSchemaValid": false,
    "failure": true
  },
  {
    "name": "empty surrounding",
    "requestChanges": [
      {
        "path": "/surroundingRanges",
        "value": []
      }
    ],
    "requestSchemaValid": false,
    "failure": true
  },
  {
    "name": "null surrounding",
    "requestChanges": [
      {
        "path": "/surroundingRanges",
        "value": null
      }
    ],
    "requestSchemaValid": false,
    "failure": true
  },
  {
    "name": "null backdrop",
    "requestChanges": [
      {
        "path": "/postTreatmentBackdrop",
        "value": null
      }
    ],
    "requestSchemaValid": false,
    "failure": true
  },
  {
    "name": "inverted range",
    "requestChanges": [
      {
        "path": "/adjacentRanges/0/upper/components",
        "value": [
          0.8,
          0.8,
          0.8
        ]
      }
    ],
    "requestSchemaValid": true,
    "failure": true
  },
  {
    "name": "transparent range",
    "requestChanges": [
      {
        "path": "/adjacentRanges/0/lower/alpha",
        "value": 0.5
      }
    ],
    "requestSchemaValid": false,
    "failure": true
  },
  {
    "name": "unknown range member",
    "requestChanges": [
      {
        "path": "/adjacentRanges/0",
        "value": {
          "lower": {
            "colorSpace": "srgb",
            "components": [
              1,
              1,
              1
            ],
            "alpha": 1
          },
          "upper": {
            "colorSpace": "srgb",
            "components": [
              1,
              1,
              1
            ],
            "alpha": 1
          },
          "extra": 1
        }
      }
    ],
    "requestSchemaValid": false,
    "failure": true
  },
  {
    "name": "positional range",
    "requestChanges": [
      {
        "path": "/adjacentRanges/0",
        "value": [
          {
            "colorSpace": "srgb",
            "components": [
              1,
              1,
              1
            ],
            "alpha": 1
          },
          {
            "colorSpace": "srgb",
            "components": [
              1,
              1,
              1
            ],
            "alpha": 1
          }
        ]
      }
    ],
    "requestSchemaValid": false,
    "failure": true
  },
  {
    "name": "noncontrol role",
    "requestChanges": [
      {
        "path": "/surface/materialRole",
        "value": "surface.base"
      }
    ],
    "requestSchemaValid": true,
    "failure": true
  },
  {
    "name": "unsupported state",
    "requestChanges": [
      {
        "path": "/surface/states/states",
        "value": [
          "checked"
        ]
      }
    ],
    "requestSchemaValid": true,
    "failure": true
  },
  {
    "name": "drag without press",
    "requestChanges": [
      {
        "path": "/surface/states/states",
        "value": [
          "dragging"
        ]
      }
    ],
    "requestSchemaValid": true,
    "failure": true
  },
  {
    "name": "stale rest",
    "requestChanges": [
      {
        "path": "/surface/states/states",
        "value": [
          "rest",
          "hover"
        ]
      }
    ],
    "requestSchemaValid": true,
    "failure": true
  },
  {
    "name": "disabled press",
    "requestChanges": [
      {
        "path": "/surface/states/states",
        "value": [
          "disabled",
          "pressed"
        ]
      }
    ],
    "requestSchemaValid": true,
    "failure": true
  },
  {
    "name": "out of range response",
    "requestChanges": [
      {
        "path": "/interactionAppearance/thumb/elastomer/dragging/depthScale",
        "value": 2.01
      }
    ],
    "requestSchemaValid": false,
    "failure": true
  },
  {
    "name": "response-adjusted content failure",
    "requestChanges": [
      {
        "path": "/minimumContentContrast",
        "value": 4.5
      },
      {
        "path": "/surface/states/states",
        "value": [
          "hover"
        ]
      }
    ],
    "requestSchemaValid": true,
    "failure": true
  },
  {
    "name": "positional key light",
    "requestChanges": [
      {
        "path": "/appearance/keyLight",
        "value": [
          "0.1.0",
          {
            "x": 0,
            "y": -1
          }
        ]
      }
    ],
    "requestSchemaValid": false,
    "failure": true
  },
  {
    "name": "read only press",
    "requestChanges": [
      {
        "path": "/readOnly",
        "value": true
      },
      {
        "path": "/surface/states/states",
        "value": [
          "pressed"